{"asset_references":["campaign-data","brief-template","rubric"],"capability_ids":["cap-calculate-cvr","cap-calculate-cpa","cap-calculate-roas","cap-correct-threshold"],"checks":[{"expected_result":"Brand Search 的 CVR 10.00%、CPA NT$300、ROAS 6.67。","id":"unit-2-result-check","on_failure":"依 unit-2-recovery 回到公式、門檻或建議界線重新檢查。","target":"三個活動的五項成效指標表"}],"context":{"prior_result":"上一單元留下三個活動的 CTR 與平均 CPC。","purpose":"完成能支持商業門檻判斷的五指標表。","situation":"你已有 CTR 與平均 CPC，現在要把點擊接到轉換成本與價值。"},"criterion_ids":["g2-cvr","g2-cpa","g2-roas","g2-correct-threshold"],"deliverable":{"acceptance_criteria":["Brand Search 的 CVR 10.00%、CPA NT$300、ROAS 6.67。","讀者可從 CSV 重算結果。"],"format":"可重算表格或 Markdown 文件","name":"三個活動的五項成效指標表","use":"交給下一單元或同事做決策與驗收。"},"depends_on":["unit-1"],"editorial_evidence":{"continuity_passed":true,"internal_labels_removed":true,"learner_readable":true,"notes":"逐段確認情境、理由、動作、結果與修復可連續閱讀，沒有待辦式正文。","reviewer_id":"course-validator-editorial","source_sha256":"f2a81642b3ac178584b13183be2f8d2ebb69085e5d70c0a0e61616ffb1e9e7c0"},"explanation":{"prose":"你已有 CTR 與平均 CPC，現在要把點擊接到轉換成本與價值。 完成能支持商業門檻判斷的五指標表。 分開判讀比例、單位成本與價值比率，不能用單一指標代替。"},"full_demonstration":{"actions":[{"action":"依頁面公式代入示範活動的實際數字，保留中間算式。","expected_result":"Retargeting Display 的 CVR 10.00%、CPA NT$400、ROAS 6.25。","purpose":"確認公式與資料欄位的對應。","start_state":"已開啟 CSV 與單元頁。"}],"input":{"description":"課程 CSV 中的示範活動","value":"Retargeting Display 的 CVR 10.00%、CPA NT$400、ROAS 6.25。"},"rationale":"先完整展示輸入、判斷、計算、結果與驗證，讓學員知道完成品質。","result":{"artifact_ref":"單元頁完整示範段落","description":"Retargeting Display 的 CVR 10.00%、CPA NT$400、ROAS 6.25。"},"verification":[{"criterion":"數字與單位正確","observable_result":"Retargeting Display 的 CVR 10.00%、CPA NT$400、ROAS 6.25。"}]},"guided_practice":{"checks":[{"expected_result":"Prospecting Social 的 CVR 5.00%、CPA NT$1,000、ROAS 2.00。","recovery_ref":"unit-2-recovery"}],"purpose":"在保留檢查提示的情況下完成第二個活動。","recovery_refs":["unit-2-recovery"],"start_state":"已看完完整示範，尚未計算引導活動。","steps":[{"action":"先自行代入，再用頁面提供的預期結果核對。","expected_result":"Prospecting Social 的 CVR 5.00%、CPA NT$1,000、ROAS 2.00。","purpose":"用同一方法處理不同數字。","start_state":"已找到引導活動那一列。"}]},"independent_practice":{"acceptance_criteria":["Brand Search 的 CVR 10.00%、CPA NT$300、ROAS 6.67。","成果可由另一位讀者重新驗證。"],"changed_conditions":["活動換成 Brand Search","必須同時驗證三種單位"],"context":"在沒有代入答案的情況下完成剩餘活動或完整摘要。","decision_required":"分開判讀比例、單位成本與價值比率，不能用單一指標代替。","deliverable":"Brand Search 的 CVR、CPA 與 ROAS，並完成全表。","verification":"依課程頁的快速檢查與 rubric 逐項核對。"},"inputs":[{"id":"campaign-data","label":"活動資料 CSV","ready_check":"看得到三列活動與五個原始數值欄位。","source":"課程首頁可下載的 campaign-data.csv"},{"id":"learner-rubric","label":"完成品驗收規則","ready_check":"看得到五項可逐條核對的完成條件。","source":"課程首頁與單元三可開啟的 rubric"}],"learner_outcome":{"evidence":"三個活動的五項成效指標表","statement":"補齊 CVR、CPA 與 ROAS，並正確判斷活動是否同時達到門檻。"},"learning_coverage":[{"assessment_evidence":["checks"],"capability_id":"cap-calculate-cvr","criterion_id":"g2-cvr","outcome_id":"outcome-metrics","practice_evidence":["guided_practice","independent_practice"],"teaching_evidence":["explanation","full_demonstration"]},{"assessment_evidence":["checks"],"capability_id":"cap-calculate-cpa","criterion_id":"g2-cpa","outcome_id":"outcome-metrics","practice_evidence":["guided_practice","independent_practice"],"teaching_evidence":["explanation","full_demonstration"]},{"assessment_evidence":["checks"],"capability_id":"cap-calculate-roas","criterion_id":"g2-roas","outcome_id":"outcome-metrics","practice_evidence":["guided_practice","independent_practice"],"teaching_evidence":["explanation","full_demonstration"]},{"assessment_evidence":["checks"],"capability_id":"cap-correct-threshold","criterion_id":"g2-correct-threshold","outcome_id":"outcome-threshold","practice_evidence":["guided_practice","independent_practice"],"teaching_evidence":["explanation","full_demonstration"]}],"outcome":"補齊 CVR、CPA 與 ROAS，並正確判斷活動是否同時達到門檻。","outcome_ids":["outcome-metrics","outcome-threshold"],"recovery":[{"action":"回到 CSV 與課程公式逐欄核對，保留算式，再依 rubric 重寫判讀。","cause":"沒有先確認分子、分母、單位或資料能支持的判斷範圍。","expected_result":"Brand Search 的 CVR 10.00%、CPA NT$300、ROAS 6.67。","id":"unit-2-recovery","symptom":"把 clicks 當成 CPA 分母，或在零 conversions 時硬除。"}],"schema_version":1,"transfer":{"limits":"彙總指標描述結果，不能單獨證明受眾、素材或版位造成差異。","method":"跨平台比較前先確認 eligible interactions 與歸因口徑一致。","new_context":"將同一方法用於另一個期間、活動組合或商業門檻。"},"unit_id":"unit-2","workflow_fingerprint":"calculate-and-compare-business-outcomes"}
